{
  "$schema": "http://json-schema.org/draft-07/schema#",
  "$id": "blueprint-schema.json",
  "title": "Nextcloud Playground Blueprint",
  "description": "Declarative configuration for provisioning a Nextcloud Playground instance at boot.",
  "type": "object",
  "additionalProperties": true,
  "properties": {
    "$schema": { "type": "string" },
    "meta": {
      "type": "object",
      "properties": {
        "title": { "type": "string" },
        "author": { "type": "string" },
        "description": { "type": "string" }
      }
    },
    "debug": {
      "type": "object",
      "properties": { "enabled": { "type": "boolean" } }
    },
    "browserCompatibility": {
      "type": "object",
      "description": "Explicit browser workarounds for trusted apps.",
      "properties": {
        "sandboxedIframes": {
          "type": "string",
          "enum": ["strict", "service-worker"],
          "default": "strict",
          "description": "service-worker removes credentialless from same-origin sandboxed app frames that already opt into allow-same-origin, allowing their resources to use the Playground Service Worker. This reduces iframe isolation and should only be enabled for trusted apps."
        }
      }
    },
    "landingPage": {
      "type": "string",
      "description": "Path to open after boot, e.g. /index.php/apps/dashboard or /index.php/login."
    },
    "siteOptions": {
      "type": "object",
      "properties": {
        "title": { "type": "string" },
        "locale": { "type": "string" },
        "timezone": { "type": "string" }
      }
    },
    "admin": {
      "type": "object",
      "description": "Admin account created by occ maintenance:install.",
      "properties": {
        "username": { "type": "string" },
        "password": { "type": "string" },
        "email": { "type": "string" }
      }
    },
    "apps": {
      "type": "array",
      "description": "Shorthand for enabling bundled apps; each entry expands to an enableApp step.",
      "items": { "type": "string" }
    },
    "steps": {
      "type": "array",
      "description": "Provisioning steps executed (in order) after install.",
      "items": {
        "type": "object",
        "required": ["step"],
        "properties": {
          "step": {
            "type": "string",
            "enum": [
              "installNextcloud",
              "login",
              "enableApp",
              "disableApp",
              "createUser",
              "createGroup",
              "addUserToGroup",
              "setConfig",
              "installApp",
              "writeFile",
              "createShare",
              "unzip",
              "runOcc"
            ]
          },
          "app": { "type": "string" },
          "appId": { "type": "string" },
          "url": {
            "type": "string",
            "description": "Source URL: the app ZIP for installApp, the file contents for writeFile, or the archive for unzip (CORS-enabled host required)."
          },
          "destination": {
            "type": "string",
            "description": "unzip: target directory for the extracted archive, relative to the Nextcloud root or absolute. A single top-level wrapper folder in the archive is stripped."
          },
          "enable": {
            "type": "boolean",
            "description": "installApp: enable the app after extracting it (default true)."
          },
          "path": {
            "type": "string",
            "description": "writeFile target, or createShare path relative to the owner's files (e.g. /welcome.md). `/<uid>/files/...` writes into that user's data directory."
          },
          "content": {
            "type": "string",
            "description": "writeFile: file contents (text, or base64 when encoding is set)."
          },
          "contents": {
            "type": "string",
            "description": "Alias for writeFile `content`."
          },
          "encoding": {
            "type": "string",
            "enum": ["utf8", "base64"],
            "description": "writeFile: how `content` is encoded (default utf8)."
          },
          "username": { "type": "string" },
          "uid": {
            "type": "string",
            "description": "Alias for username / createShare owner."
          },
          "password": { "type": "string" },
          "displayName": { "type": "string" },
          "email": { "type": "string" },
          "groups": { "type": "array", "items": { "type": "string" } },
          "group": { "type": "string" },
          "gid": {
            "type": "string",
            "description": "Alias for group."
          },
          "owner": {
            "type": "string",
            "description": "createShare: user who owns the path (default admin)."
          },
          "shareType": {
            "description": "createShare: public/link (3), user (0), or group (1). Names or OCS integers.",
            "oneOf": [{ "type": "string" }, { "type": "integer" }]
          },
          "shareWith": {
            "type": "string",
            "description": "createShare: recipient uid or gid for user/group shares."
          },
          "permissions": {
            "description": "createShare: read/update/create/delete/share/all, a bitmask, or an array of names. Default read for public, all otherwise.",
            "oneOf": [
              { "type": "string" },
              { "type": "integer" },
              { "type": "array", "items": { "type": "string" } }
            ]
          },
          "expireDate": {
            "type": "string",
            "description": "createShare: public-link expiry (YYYY-MM-DD)."
          },
          "note": { "type": "string" },
          "label": { "type": "string" },
          "key": { "type": "string" },
          "value": {},
          "args": { "type": "array", "items": { "type": "string" } }
        }
      }
    }
  }
}
