{
  "$schema": "./blueprint-schema.json",
  "meta": {
    "title": "Default Nextcloud Playground Blueprint",
    "author": "nextcloud-playground",
    "description": "Baseline browser blueprint for Nextcloud Playground."
  },
  "debug": { "enabled": false },
  "landingPage": "/index.php/apps/files/files",
  "siteOptions": {
    "title": "Nextcloud Playground",
    "locale": "en",
    "timezone": "UTC"
  },
  "admin": {
    "username": "admin",
    "password": "admin",
    "email": "admin@example.com"
  },
  "apps": [],
  "steps": [
    { "step": "disableApp", "app": "firstrunwizard" },
    { "step": "setConfig", "app": "core", "key": "whatsNewEnabled", "value": "no" }
  ]
}
